제목,작성자,출판사,제작년도,journal,link,abstracts
인공지능 담론과 법의 사회적 현재성,"송영현(Song, Young Hyun)",한국법학회,2018,법학연구,https://www.riss.kr/search/detail/DetailView.do?p_mat_type=1a0202e37d52c72d&control_no=6a9e706ea4b64c617f7a54760bb41745&keyword=인공지능,"“인공지능”은 이제 생활의 일부가 되었고, 누구나 말할 수 있는 이야깃거리를 만들어냈다. 다양한 영역에서 등장하는 인공지능 담론은 인간에 의해 발전된 과학기술의 현재 모습뿐만 아니라 인간에 대한 이해를 요구한다. ‘인공지능 담론’은 하나의 문화현상이다. 문화현상은 사회적인 산물이다. 이제 유익한 측면에서 인공지능은 누구나 말할 수 있는 대상이 되었고, 누구나 사용할 수 있게 되었다. 그러나 인간이 역사 속에서 만들어낸 수많은 발명품 가운데 하나로 치부될 수도 있는 인공지능이 알게 모르게 인간으로 하여금 큰 두려움을 갖게 하는 것도 사실이다. 인문학에서, 사회과학에서, 공학적 측면에서, 기술적 측면에서의 논의 전개와 발전의 측면과는 별개로 법의 역할이나 기능론적 관점에서 인공지능에 대한 논의가 아무리 강조되어도 지나치지 않은 이유가 여기에 있는 것이다. 인공지능을 생각하고 만드는 인간과 또 그러한 인간과 인공지능의 관계에 대해서는 오래전부터 영화나 소설 같은 매체에 의해 셀 수 없이 표현되어 왔다. 그럼에도 그 속에서의 인간은 -최고 수준의 기술을 가졌음에도- 스스로를 모방한 부산물을 그려내 둘이 보여주는 시선과 경계의 모호함을 드러내고 말았다. 따라서 지금의 인공지능은 그 가장 첨예한 경계선상에 놓여 있는 인간 욕망의 집적체인 셈이 되었다. 공학적인 부분, 산업적인 부분, 기술적인 부분, 인문학적 부분 등 무수히 많은 영역에서 인공지능을 다루고 있지만 법은 여전히 인공지능을 관찰하고 있는 중이다. 법은 인간의 욕망을 제한하는 것으로 스스로의 임무를 설정했다. 하지만 시간과 사회는 일찍이 법의 한계를 알고 인간의 욕망을 분리시켰다. 악한 욕망에 대해서는 지속적인 제한을 가하지만, 선한 욕망에 대해서는 오히려 진작할 수 있게끔 법을 설계한 것이다.
  2016년 3월 9일 시작되어 그 엿새 뒤에 막을 내린 구글 딥마인드 챌린지 매치는 한국 사회에 인공지능의 현재를 뚜렷하게 각인시키는 크나 큰 사건이었다. 이 대결의 전후에 전개된 인공지능에 관한 무수한 담론들은 수많은 영역과 분야에서 화제를 낳았고 이슈를 이루었으며 그 만큼의 문제가 제기되었다. 이 글은 이렇듯 다양한 형태로 발현된 ‘인공지능의 이슈화’ 현상에 맞물려 우리 사회에 등장한 언론 속의 담론을 헤아려 분석하는 작업을 통해 그에 대한 법의 모습을 찾아보았다. 이 같은 작업은 인공지능과 관련된 사회적 문제의 대응 방안에 대한 단서를 제공해 줄 수 있을 것이다. 오늘날 우리는 빠르게 변화하는 기술문명시대에 살고 있다. 그러나 우리는 언제나 바로 그 만큼, 그 그늘을 생각해야 한다. 따라서 그 어느 때보다 인간의 보호에 잇닿은 법 내면의 사고의 틀에 의한 논의가 절실하게 요청되는 것이다. 이 글에서는 인공지능 담론을 세 가지의 대상화로 상정하여 살펴보았다. 윤리의 대상화와 편리의 대상화, 그리고 법리의 대상화가 그것이다. 윤리적인 면에서는 인간과의 관계를, 편리함의 측면에서는 생활에서의 효율성을, 법리적인 면에서는 제도적인 뒷받침을 헤아려 보았고, 이를 통해 법의 사회적 필요를 확인할 수 있었다.
  우리는 비록 그 목적의 선함이나 의도의 순수함에도 인공지능에 투영된 인간의 모습으로 말미암아 법을 소환한다. 그렇기에 인공지능 담론에는 인간과 사상과 문화, 있는 그대로의 인공지능의 위력과 그 현상의 파급력을 다루어 이와 연관시킨 실증적인 법의 존재 의의를 되살리려는 법적 담론이 분명하게 더해져야 한다. Discourses regarding Artificial Intelligence which appear in various fields, demand an understanding of not only technological development by human but also about human itself. The image of human beings creating Artificial Intelligence which can replace human, has long been expressed through mediums such as movies and fiction novels, regardless of its actual success. In such situations however, despite possessing the highest level technology, the actual by-product did not become similar to human, rather it simply imitated human in different ways. Law is a constraint on human desire, and has set a mission for one’s self. However, time and society recognized the limitations of law early on, and classified the human desires. Evil desires were continuously restricted, on the contrary the law was designed to allow for stimulation of good desires.
  However, an ambiguous area in terms of such boundary has been brought into this world. AI is the aggregate of human desire that lies on the very acute boundary line at this very moment. AI is a topic handled by various fields including engineering, industrial, technology, humanities and etc. However, the law is still in the process of observing AI. ‘AI discourse’ is one of the cultural phenomenons. Cultural phenomenon is a product of society. Now, AI has become a subject that anyone can talk about from a beneficial aspect, and anyone can also use it as well. However, regarding this AI that can be considered as simply one of the countless human inventions in history, it is also true that it is a subject of fear more so than anything else to human, both knowingly and unknowingly. Separate from development of discussion and advancement in humanities, social science, engineering, technological aspect, discussions on AI from the perspective of the role of law and functional position should be emphasized to the maximum and the need for it, is indeed in here.
  The Google Deepmind Challenge Match that started on the 9th of March, 2016 and concluded in six days, was a major event that clearly engraved the present state of AI to the Korean society. Countless numbers of discourses regarding AI that unfolded before and after this match, became a major issue, and just as many problems were raised in various fields. As such, this study sought for the figure of law through analysis and consideration of discourses in the media that appeared in our society, which is interconnected to the ‘heightened attention on AI’ phenomenon that has manifested itself in various forms. Such work will provide a lead regarding legal response preparing for countless problems related to AI. Nowadays, we live in a rapidly changing technological civilization era. However, we should always think in such amount, about such a shade. Therefore, more so than any other time, this is the time with the most urgent need for active discussions set on the thoughts within law that is alongside protection of human.
  This writing objectified the AI discourses into three types in introducing them in for the study. The three mentioned are objectification of ethics, objectification of convenience and objectification of the principle of law. It was an attempt to comprehend the relationship with human from the ethical aspect, effectiveness in life from the convenience aspect, systematic support from the legal aspect. And through the same, we were able to verify the social need for the law.
  We must think again about how the unintended damage caused by AI can be resolved through legal approach, regardless of whether or not the objective was good-natured. Accordingly, AI and AI discourses on AI must deal with human, thoughts and culture, the power of AI as is and the influence of such phenomenon so that the legal discussion that can revive the meaning of the existence of objective law related to this, can clearly be added."
인공지능을 악용한 테러가능성과 대응전략,이만종,원광대학교 경찰학연구소,2017,경찰학논총,https://www.riss.kr/search/detail/DetailView.do?p_mat_type=1a0202e37d52c72d&control_no=b417a21e969af57be9810257f7042666&keyword=인공지능,"본 논문은 인공지능을 악용한 미래의 테러 가능성을 고찰하기 위한 것이다. 이를위해 테러리즘의 개념과 양상의 변화, 인공지능기술개발의 발전과 명암, 인공지능을악용한 미래의 테러 가능성, 인공지능 악용테러에 대한 대응전략을 분석한 후 결론을도출해본 것이다. 오늘날의 테러위협은 테러의 목적과 양상이 갈수록 다양해지고 있다. 인간이 인간을 살해하는 테러가 지속적으로 발생하고 있다. 그런데 앞으로는 인간이 인공지능을이용해 인간을 공격하는 일이 벌어질 수 있다는 데에 인공지능과 관련한 고민이 있다. 테러리스트가 인공지능을 갖춘 드론, 자동차, 그리고 킬러로봇 등에게 테러학습을시킨 후에 고성능 화생방 무기로 공격하도록 할 수도 있을 것이다. 실로 엄청난 테러의 재앙을 불러일으킬 수 있을 것이다. 따라서 빅 데이터 ,인공지능 등으로 대변되는 지능형 정보시대의 테러위협에 대응하기 위한 사전대응역량을 강화하는 지능형안전망 구축을 위한 사전대비는 매우 시급한 사항이다. 이를 위해 인공지능의 권한ㆍ책임소재를 명료화하여야 하고 킬러로봇은 신중히 제작되어야 할 것이다. 아울러 인공지능 악용 테러방지를 위한 기술적 능력배양, 법률ㆍ제도적 장치의 마련, 대량의 위협정보를 분석해 사회전반의 안전 확보를 위한 첨단대응, 그리고 국제협력 등을 모색하고 테러의 근본원인해결을 위해서도 노력해 나가야 할 것이다. The purpose of this paper is to analyze the possibility of future terrorism using artificial intelligence. To this end, the paper is composed of 5 chapters titled introduction; changes in the concept and aspect of terrorism; the development of artificial intelligence technology and its bright side and dark side; the possibility of future terrorism ubusing artificial intelligence; strategies for dealing with artificial intelligence abuse terror; and conclusion. Today’s terrorist threats are becoming more diverse in purpose and aspect. There is a continuing occurrence of terrorism in which people kill people. In the future, however, there is a concern about artificial intelligence that human beings can attack human beings by using artificial intelligence. Terrorists can teach artificial intelligence machines(drones, cars, and killer robots etc.) how to terrorize, and then let them attack people with high-performance CBR weapons. Indeed, it can bring about a terrible terrorist disaster. Now, the future of artificial intelligence robots, unmanned vehicles, unmanned aerial vehicles, etc is unfolding. The prospects for the evolution of artificial intelligence and human life are mixed. If the expectation that artificial intelligence will make human life more enriching is a pink prospect, the concern that artificial intelligence, which has evolved to evolve, will threaten mankind is a gray prospect. The evolution of artificial intelligence improves quality of life and productivity. However, as technology becomes more sophisticated and automation becomes higher, it can become a state of uncontrollable or abuse by a group of special purposes, which can cause serious social and ethical problems. Specifically, the damage caused by the use of artificial intelligence technology, such as an automated weapon, a killer robot, etc., in the hands of a terrorist would be a terrible situation to even imagine. Therefore countermeasures against terrorist abuse should be sought. Therefore, the authority and responsibility of artificial intelligence should be clarified and the killer robot should be carefully manufactured. We should seek to cultivate technical capacity for artificial intelligence abuse terrorism prevention, to establish legal and institutional devices, and to seek international cooperation and to resolve the root cause of terrorism."
인공지능 전환시대의 정부모습과 지향: 인공지능정부,한세억(韓世億),한국지역정보화학회,2021,한국지역정보화학회지,https://www.riss.kr/search/detail/DetailView.do?p_mat_type=1a0202e37d52c72d&control_no=7ce652372ebf4b4f4884a65323211ff0&keyword=인공지능,"인공지능이 다양한 산업과 영역에 걸쳐 인간능력을 능가한 것으로 평가된다. 디지털 전환의 중추기술인 인공지능이 국가정책 Agenda로 부각되고 있다. 인공지능을 활용하여 산업육성과 기업경쟁력 강화를 위한 노력이 전개되고 있다. 인공지능 국가전략은 단순히 인공지능 기술개발과 산업육성을 넘어 국가사회의 당면과제 해결, 사회시스템의 혁신과 최적화, 국민생활의 질 향상 등을 위한 정부구현을 포함한다. 하지만 정부는 어떤가? 여전히 관료제정부에서 벗어나지 못하는 듯하다. 정책문제에 무기력하고 부패하며 불공정하고 낭비와 비효율에서 자유롭지 못하다. 모든 것이 인공지능으로 통하는 인공지능 전환시대에서 창조적 탈바꿈이 요구되는 정부에게 어떠한 모습, 지향, 가치가 필요한가? 디지털 전환의 심화 및 고도화에 부응하여 창조성, 청렴성, 공정성 그리고 책임성, 윤리의식 등으로 무장된 공직자에 의한 정부기능과 역할이 한층 요구된다. 본 연구는 인공지능 전환시대에서 바람직한 인공지능 정부모습과 지향을 제시하고 실천방안의 탐색에 목적을 두고자 한다. Artificial intelligence, the central technology of digital transformation, is emerging as a national policy agenda. The national strategy of artificial intelligence is expected to be an optimal alternative to solving the challenges of the national society, innovating and optimizing social systems, and improving the quality of people""s lives beyond just developing artificial intelligence technology and fostering industries. But what about the government? It still seems to be unable to escape from the bureaucracy. It is lethargic and corrupt in policy issues, unfair, and not free from waste and inefficiency. In the era of artificial intelligence transformation where everything leads to artificial intelligence, what kind of image, orientation, and value do governments that require creative transformation need? In response to the deepening and advancement of digital transformation, government functions and roles by public officials armed with creativity, integrity, fairness, accountability, and ethics are further required. The purpose of this study is to present the desirable appearance and value of artificial intelligence government in the era of artificial intelligence transition and to explore practical measures for implementation."
인공지능 비서에 대한 소비자의 지각된 가치와 신뢰가 수용의도에 미치는 영향,"장민흔,이진명",한국소비자정책교육학회,2021,소비자정책교육연구,https://www.riss.kr/search/detail/DetailView.do?p_mat_type=1a0202e37d52c72d&control_no=9b2dd927221760a4d18150b21a227875&keyword=인공지능,"본 연구의 목적은 잠재적인 인공지능 비서 수용자들이 현재 인공지능 비서의 혜택과 희생을 어떻게 지각하고 있는지 살펴보고, 가치기반 수용모델을 기반으로 지각된 혜택과 희생 요인 및 신뢰가 소비자의 인공지능 비서 수 용의도에 미치는 영향력을 규명하는 것이다. 이를 위해 인공지능 비서에 관심이 있으나 현재 사용하고 있지 않은 20대에서 50대까지의 잠재적 수용자를 대상으로 온라인 설문조사를 실시하였으며 총 354명의 유효자료를 수집 하여 SPSS 24.0 및 AMOS 24.0 프로그램을 이용하여 분석하였다. 인공지능 비서에 대한 소비자 인식 수준을 확인한 결과, 혜택 요인 중 즐거움에 대한 지각이 가장 높으며 공감 성은 상대적으로 낮은 수준으로 나타났다. 희생 요인 중에서는 사생활침해 위험을 가장 높게 지각하는 것으로 나 타났다. 구조방정식 모형분석을 통해 가설을 검증한 결과 개인화 혜택, 즐거움, 공감성이 높아질수록 지각된 가 치가 유의하게 높아지며, 경제적 비용과 사생활침해 위험이 높아질수록 지각된 가치가 유의하게 낮아지는 것으로 나타났다. 또한, 지각된 가치와 소비자 신뢰가 인공지능 비서 수용의도에 모두 유의한 긍정적 영향을 미치는 것 으로 나타났다. 부츠스트래핑을 통해 매개효과를 살펴본 결과, 개인화 혜택, 즐거움, 공감성 그리고 경제적 위험 이 지각된 가치를 매개로 인공지능 비서 수용의도에 유의한 영향을 미치는 것으로 나타났다. 본 연구는 인공지능 비서에 대한 소비자의 총체적 가치지각과 인공지능 비서에 대한 신뢰가 수용의도에 미치는 영향력을 규명함으로써 관련 산업계에 실무적 함의를 제공하며 소비자 중심의 인공지능 기술 관련 연구를 확장한 다는 점에서 학문적 의의를 지닌다. The purpose of this study is to investigate the effects of artificial intelligent(AI) assistants' benefits and sacrifice factors on perceived values and the effects of perceived values and trust on Adoption intention by applying the theoretical framework of the ‘Value-based Adoption Model’. To this end, an online survey was conducted for potential adopters of AI assistants in their 20s to 50s, and a total of 354 valid data were collected and analyzed using SPSS 24.0 and AMOS 24.0 programs. The main results are summarized as follows. First, among the benefit factors of AI assistants, the perception of pleasure was the highest and the perception of empathy was relatively low. Among the sacrifice factors, the perception of the risk of privacy invasion was the highest. Second, as a result of structural equation model analysis, it was found that personalization benefits, enjoyment, and empathy had a significant positive effect on perceived value for AI assistants. On the other hand, it was found that the economic cost and the risk of invasion of privacy had a significant negative effect on the perceived value of the AI assistant. Third, it was found that both perceived value and consumer trust had a significant positive effect on the intention to adopt AI assistants. In addition, as a result of bootstrapping, personalization benefits, enjoyment, empathy, and economic risk had a significant indirect effect on the intention to adopt an AI assistant through perceived value. These results suggest that it is important not only to increase the value of the service, but also to increase trust in the service providers. This study provides practical implications to the industry related to AI assistants by examining the influence of consumers' overall perception of value and trust in AI assistants on adoption intentions and has academic significance in expanding research on AI technology centered on consumers."
인공지능 시대에서 기술 교육의 방향에 관한 고찰,"임미가(Lim, Mika)",한국실과교육학회,2020,한국실과교육학회지,https://www.riss.kr/search/detail/DetailView.do?p_mat_type=1a0202e37d52c72d&control_no=508b4cb5e4427fe44884a65323211ff0&keyword=인공지능,"이 연구의 목적은 인공지능 시대의 기술 교육에 대하여 고찰하고, 다가올 교육적 변화를 대비하고 선도하기 위한 유의미한 시사점을 얻는 데 있었다. 이를 위해 인공지능에 대한 교육, 인공지능을 활용한 교육, 기술 교육, 융합교육과정 등의 이론과 문헌을 고찰하였다. 고찰을 통해 얻은 연구의 결론 및 시사점은 다음과 같다. 첫째, 인공지능의 발달은 우리의 가정생활, 기술의 세계 및 예술, 금융, 국방, 노동시장 등 사회 여러 영역에 큰 영향을 미치고 있었다. 둘째, 인공지능은 교육의 흐름도 바꾸었는데 미국에서는 인공지능연합회가 결성되어 초·중·고등학교 학생들을 위한 인공지능 교육과정을 체계적으로 계획하는 등 해외 여러 국가에서 인공지능 교육에 집중적인 노력을 기울이고 있음을 알 수 있었다. 셋째, 인공지능을 교육에 활용할 수 있는 시스템(AIED)은 크게 세가지 맥락으로 볼 수 있으며 그것은 비교적 구조화된 문제를 다루기에 적합한 지능형 튜터링 시스템(ITS), 반구조화된 문제를 다루기에 적합한 대화형 튜터링 시스템(DBTS), 비구조화된 문제를 다루기에 적합한 탐구학습 시스템(ELE)로 나눌 수 있었다. 넷째, 기술적 소양과 인공지능의 소양은 내용과 방법이 유사한 특성을 보였으며, 인공지능의 문제해결 과정은 문제인식, 데이터 탐색 및 분류, 알고리즘 선정, 적용 및 일반화로써 기술적 문제해결과정인 문제이해, 아이디어탐색, 실현, 평가와 유사한 과정을 보였다. 다섯째, 기술교육은 인공지능 융합교육에 있어서 ‘무엇을 융합할 것인가?’와 ‘어떻게 융합할 것인가?’ 에 대하여 고민하여야 한다. 즉, 내용적 측면에서 어떠한 개념과 지식을 융합할 것인지와 융합의 범위를 고민하여야 하며, 과정적 측면에서 어떠한 과정을 융합할 것인지와 융합의 범위를 고민하여야 한다. 이와 함께 무엇을 중심으로 융합할지 즉, 기술 교육 중심(TE-oriented)으로 융합할 것인지, 인공지능 중심(AI-oriented)으로 융합할 것인지 고민하여야 한다. 또한, 종합적인 관점에서 다양한 융합교육 실현의 방안을 모색해야 한다. 실현 방안에는 기술적 문제해결의 특성을 활용하는 방안, 인공지능 교육 시스템(AIED)의 특성을 활용하는 방안, 기술 교육에 적합한 AIED를 개발하는 방안 등이 있다. The purpose of this study were to examine technology education in the age of artificial intelligence and to obtain meaningful implications to prepare a foundation for the upcoming changes. To this end, theories and literature on artificial intelligence and society, education on artificial intelligence, education using artificial intelligence, technology education, and convergence curriculum were reviewed. The results of the study were as follows. First, the development of artificial intelligence has had a great influence on various areas of society such as our family life, the world of technology, art, finance, defense, and the labor market. Second, artificial intelligence changed the flow of education. In the United States, the AI Association was formed to systematically plan artificial intelligence curriculum for elementary, middle, and high school students, and many countries abroad are focusing on AI education. And it was found. Third, a system that can utilize artificial intelligence for education (AIED) can be seen in three main contexts, an intelligent tutoring system (ITS) suitable for dealing with relatively structured problems, and an interactive tutoring system suitable for dealing with semi-structured problems. (DBTS) and Inquiry Learning System (ELE) suitable for dealing with unstructured problems. Fourth, technology education aims to cultivate technological literacy, and technological literacy and artificial intelligence literacy showed similar characteristics in terms of contents and methods. Fifth, as a result of examining the problem solving of artificial intelligence, the problem solving process of artificial intelligence is similar to problem understanding, idea search, realization, and evaluation, which are technology problem solving processes by problem recognition, data search and classification, algorithm selection, application, and generalization. Showed. Sixth, technology education should consider what will be integrated? and how will it be integrated? in artificial intelligence convergence education. In other words, it is necessary to consider what concepts and knowledge will be fused in terms of content and the scope of fusion, and in terms of process, what process will be fused and the scope of fusion. At the same time, it is necessary to think about what to focus on, that is, whether to converge with TE-oriented or AI-oriented."
