제목,작성자,출판사,제작년도,journal,link,abstracts
딥러닝의 변수 중요도를 이용한 인공지능 기술 분석,"김승환(Seungwhan Kim),전성해(Sunghae Jun)",한국지능시스템학회,2019,한국지능시스템학회논문지,https://www.riss.kr/search/detail/DetailView.do?p_mat_type=1a0202e37d52c72d&control_no=2018b7600d122280d18150b21a227875&keyword=인공지능,"인공지능 기술은 빠른 속도로 발전하고 있다. 특히 인공지능 개발을 이끌고 있는 많은 세부기술 간의 관계를 파악하는 것은 인공지능 기술을 이해하는데 중요하다. 본 연구에서는 이와 같은 인공지능의 기술 분석을 위하여 딥러닝을 적용한다. 최근 전통적인 통계학 및 머신러닝 기법에 비해 딥러닝의 예측 성능이 더 우수함을 보여주는 다양한 연구결과가 발표되고 있다. 하지만 최종 예측과 함께 예측에 사용된 입력변수들의 상대적인 중요도를 파악하는 것은 기존의 통계적 기법에 비해 딥러닝이 가지고 있는 어려움 중 하나이다. 예측모형에서 입력변수가 출력변수에 어떤 형태로 영향을 주는지 확인하려는 연구는 여러 분야에서 이루어지고 있다. 선형회귀분석은 입력변수의 중요도를 확인하기 위하여 표준화 회귀계수를 이용한다. 본 논문에서는 가중치 분석을 통하여 딥러닝의 입력변수 중요도를 계산하여 인공지능 기술에 영향을 미치는 세부기술에 대한 기술 분석을 수행한다. 제안 방법의 타당성을 보이기 위하여 인공지능 기술관련 특허문서를 수집하고 분석하여 인공지능 세부기술간 기술 연관성을 확인한다. Artificial intelligence (AI) technology has been developed at a fast pace. In particular, understanding the relationship between various sub technologies leading to AI development is very important to understand AI. In this study, we use deep learning to analyze AI technology. Many studies have been published showing the prediction performance of deep running is superior to the conventional statistical and machine learning methods. However, understanding the relative importance of input variables used in the prediction of output variable is one of the difficulties of deep learning compared to the existing statistical methods. There are many studies in various fields to find out how the input variable affects the output variable in forecasting. For example, linear regression analysis uses standardized coefficients to determine the variable importance. This paper performs technology analysis on the sub technologies that influence AI technology using the variable importance of deep learning. To show the validity of the proposed methodology, we collect and analyze patent documents related to AI technology."
인공지능 기술 기반 인슈어테크와 디지털보험플랫폼 성공사례 분석: 중국 평안보험그룹을 중심으로,"이재원(JaeWon Lee),오상진(SangJin Oh)",한국지능정보시스템학회,2020,지능정보연구,https://www.riss.kr/search/detail/DetailView.do?p_mat_type=1a0202e37d52c72d&control_no=b19e182b52eecc5de9810257f7042666&keyword=인공지능,"최근 전 세계 보험업계에도 기계학습, 자연어 처리, 딥러닝 등의 인공지능 기술 활용을 통한 디지털 전환이 급속도로 확산하고 있다. 이에 따라 인공지능 기술을 기반으로 한 인슈어테크와 플랫폼 비즈니스 성공을 이룬 해외 보험사들도 증가하고 있다. 대표적으로 중국 최대 민영기업인 평안보험그룹은 ‘금융과 기술’, ‘금융과 생태계’를 기업의 핵심 키워드로 내세우며 끊임없는 혁신에 도전한 결과, 인슈어테크와 디지털플랫폼 분야에서 괄목할만한 성과를 보이며 중국의 글로벌 4차 산업혁명을 선도하고 있다. 이에 본 연구는 평안보험그룹 인슈어테크와 플랫폼 비즈니스 활동을 ser-M 분석 모델을 통해 분석하여 국내 보험사들의 인공지능 기술기반 비즈니스 활성화를 위한 전략적 시사점을 제공하고자 했다. ser-M 분석 모델은 기업의 경영전략을 주체, 환경, 자원, 메커니즘 관점에서 통합적으로 해석이 가능한 프레임으로, 최고경영자의 비전과 리더십, 기업의 역사적 환경, 다양한 자원 활용, 독특한 메커니즘 관계가 통합적으로 해석되도록 연구하였다. 사례분석 결과, 평안보험은 안면·음성·표정 인식 등 핵심 인공지능 기술을 활용하여 세일즈, 보험인수, 보험금 청구, 대출 서비스 등 업무 전 영역을 디지털로 혁신함으로써 경비 절감과 고객서비스 발전을 이루었다. 또한 ‘중국 내 온라인 데이터’와 ‘회사가 축적한 방대한 오프라인 데이터 및 통찰력’을 인공지능, 빅데이터 분석 등 신기술과 결합하여 금융 서비스와 디지털 서비스 사업이 통합된 디지털 플랫폼을 구축하였다. 이러한 평안보험그룹의 성공 배경을 ser-M 관점에서 분석해 보면, 창업자 마밍즈 회장은 4차 산업혁명 시대의 디지털 기술발전, 시장경쟁 및 인구 구조의 변화를 빠르게 포착하여 새로운 비전을 수립하고 디지털 기술중시의 민첩한 리더십을 발휘하였다. 환경변화에 대응한 창업자 주도의 강력한 리더십을 바탕으로 인공지능 기술 투자, 우수 전문인력 확보, 빅데이터 역량 강화 등 내부자원을 혁신하고, 외부 흡수역량의 결합, 다양한 업종 간의 전략적 제휴를 통해 인슈어테크와 플랫폼 비즈니스를 성공적으로 끌어냈다. 이와 같은 성공사례 분석을 통하여 인슈어테크와 디지털플랫폼 도입을 본격 준비하고 있는 국내 보험사들에게 디지털 시대에 필요한 경영 전략과 리더십에 대한 시사점을 줄 수 있다. Recently, the global insurance industry is rapidly developing digital transformation through the use of artificial intelligence technologies such as machine learning, natural language processing, and deep learning. As a result, more and more foreign insurers have achieved the success of artificial intelligence technology-based InsurTech and platform business, and Ping An Insurance Group Ltd., China""s largest private company, is leading China""s global fourth industrial revolution with remarkable achievements in InsurTech and Digital Platform as a result of its constant innovation, using ‘finance and technology’ and ‘finance and ecosystem’ as keywords for companies.
  In response, this study analyzed the InsurTech and platform business activities of Ping An Insurance Group Ltd. through the ser-M analysis model to provide strategic implications for revitalizing AI technology-based businesses of domestic insurers. The ser-M analysis model has been studied so that the vision and leadership of the CEO, the historical environment of the enterprise, the utilization of various resources, and the unique mechanism relationships can be interpreted in an integrated manner as a frame that can be interpreted in terms of the subject, environment, resource and mechanism. As a result of the case analysis, Ping An Insurance Group Ltd. has achieved cost reduction and customer service development by digitally innovating its entire business area such as sales, underwriting, claims, and loan service by utilizing core artificial intelligence technologies such as facial, voice, and facial expression recognition. In addition, ""online data in China"" and ""the vast offline data and insights accumulated by the company"" were combined with new technologies such as artificial intelligence and big data analysis to build a digital platform that integrates financial services and digital service businesses. Ping An Insurance Group Ltd. challenged constant innovation, and as of 2019, sales reached $155 billion, ranking seventh among all companies in the Global 2000 rankings selected by Forbes Magazine.
  Analyzing the background of the success of Ping An Insurance Group Ltd. from the perspective of ser-M, founder Mammingz quickly captured the development of digital technology, market competition and changes in population structure in the era of the fourth industrial revolution, and established a new vision and displayed an agile leadership of digital technology-focused. Based on the strong leadership led by the founder in response to environmental changes, the company has successfully led InsurTech and Platform Business through innovation of internal resources such as investment in artificial intelligence technology, securing excellent professionals, and strengthening big data capabilities, combining external absorption capabilities, and strategic alliances among various industries.
  Through this success story analysis of Ping An Insurance Group Ltd., the following implications can be given to domestic insurance companies that are preparing for digital transformation. First, CEOs of domestic companies also need to recognize the paradigm shift in industry due to the change in digital technology and quickly arm themselves with digital technology-oriented leadership to spearhead the digital transformation of enterprises. Second, the Korean government should urgently overhaul related laws and systems to further promote the use of data between different industries and provide drastic support such as deregulation, tax benefits and platform provision to help the domestic insurance industry secure global competitiveness. Third, Korean companies also need to make bolder investments in the development of artificial intelligence technology so that systematic securing of internal and external data, training of technical personnel, and patent applications can be expanded, and digital platforms should be quickly established so that diverse customer experiences can be"
SNS 감성분석을 통한 맞춤형 노래 추천 인공지능 스피커,"박재현(Jae-hyun Park),오주연(Joo-yeon Oh),민경은(Kyeong-eun Min),박민주(Min-joo Park),주종화(Joo Jong Wha)",한국지능정보시스템학회,2019,한국지능정보시스템학회 학술대회논문집,https://www.riss.kr/search/detail/DetailView.do?p_mat_type=1a0202e37d52c72d&control_no=7ae562b573a7f6dce9810257f7042666&keyword=인공지능,"인공지능 스피커는 현재 많은 관심과 함께 전 세계적으로 시장의 성장세가 주목받고 있다. 인공지능 스피커에서 가장 많이 사용되는 기능인 음악 추천 시스템 기능을 KSB 인공지능 프레임워크로 발전시켜, 사용자의 하루 동안의 감정을 고려해 1 대 1 맞춤형 음악을 추천하는 음악 큐레이션 서비스를 개발하고자 한다. 여기에 사용자의 감정 상태를 분석한 데이터를 이용하여 사용자의 심리를 진정시킬 수 있는 심리치료 기능을 넣어 기존의 음악 추천 알고리즘과 차별화를 주도록 한다. 사용자의 감정 상태 분석을 위해 SNS 데이 터를 수집하여 텍스트마이닝과 감성 분석을 진행하고, 사용자가 즐겨 듣는 음악 장르와 사용자가 현재 관심 있는 키워드를 고려하여 감성 상태에 맞는 음악을 추천하는 인공지능 스피커 응용 프로그램 개발을 목표로 하고 있다."
학습된 신경망 모델을 이용한 인공지능 코딩교육 방안,"박성훈,박충식",한국지능정보시스템학회,2021,한국지능정보시스템학회 학술대회논문집,https://www.riss.kr/search/detail/DetailView.do?p_mat_type=1a0202e37d52c72d&control_no=7db639a03eba75cfb7998d826d417196&keyword=인공지능,"인공지능 기술이 비약적으로 발전으로 야기된 4차산업혁명시대에 인공지능 기술에 대한 이해와 이를 위한 교육이 필요하게 되었다. 본 연구는 교양 교육, 비전공 교육, 전공초기교육, 또는 초중고 교육에서 단순한 코딩 교육을 넘어 인공지능 코딩교육을 용이하게 하기 위한 방안을 모색하고 한가지 사례를 기술한다. 인공지능기술 중 인공신경망 기술은 사전 학습된 딥러닝 모델들을 사용할 수 있는 환경이 제공되기 때문에 학습자들이 장난감 문제(toy problem)가 아닌 실제적인 주제를 흥미롭게 탐색할 수 있는 코딩교육을 구성할 수 있다. 본 연구에서 하나의 사례에서는 KakaoBrain의 Pororo를 이용하였다."
인공지능 서비스 플랫폼 기반 제조경보시스템 개발: 연속주조공정을 대상으로,"채희철(Hee Chel Che),이정한(Joung-Han Lee),이준석(Junseok Lee),백민재(Minjae Baek),이성락(SeongRak Lee),김창원(ChangWon Kim)",한국지능시스템학회,2021,한국지능시스템학회논문지,https://www.riss.kr/search/detail/DetailView.do?p_mat_type=1a0202e37d52c72d&control_no=6cab3cf053b176a4c85d2949c297615a&keyword=인공지능,"빅데이터, 인공지능, IoT기술과 같은 디지털 기술의 발달은 오늘날 많은 산업 분야의 변화와 혁신을 이끌고 있다. 제조업 분야에서도 디지털 기술의 적용을 통해 많은 혁신이 이루어지고 있으며, 대표적으로는 스마트공장이 있다. 디지털 트랜스포메이션을 위해서는 많은 디지털 기술이 필요하며, 그 중 인공지능은 응용가능성이 높은 기술 중 하나이다. 하지만, 아직까지 AI서비스 및 서비스 플랫폼에 대한 표준이 정립되어있지 않고, 관련 인력도 부족하여 AI서비스 개발과 운영이 매우 어려운 실정이다. 본 연구에서는 제조업에서 이러한 어려움 해소에 도움이 될 수 있는 AI서비스 플랫폼을 제안하며, 인공지능 서비스를 제조업에 활용한 제조경보시스템도 같이 제안한다. 제안한 인공지능 서비스 플랫폼과 제조경보시스템에 대해 본 연구에서는 제철공정 중 하나인 연주공정을 대상으로 수행하였으며, 제안된 시스템의 활용가능성을 확인할 수 있다. Today, the development of digital technology, such as big data, Artificial Intelligence, and the Internet of Things, leads to changes and innovations in various industries. For example, a lot of manufacturing companies try to apply digital technology to improve productivity. It is smart factory. Digital transformation is needed a lot of digital technology. Among them, AI is higher technology for applicability. However, the standard of AI services and service platform is not fixed yet. Also, AI developers and data scientists are not enough to satisfy demand. Due to these reasons, new service-based AI is challenging to apply in the manufacturing industry. In this study, we suggest the manufacturing warning system based on an artificial intelligence platform for helping the above problem. The proposed system is applied in continuous casting processing of the steel manufacturing industry, and we are able to find out the feasibility for the proposed."
유아 교사를 위한 인공지능 교육 프로그램 개발 연구,이경희,제주대학교 지능소프트웨어 교육연구소,2022,지능정보융합과 미래교육,https://www.riss.kr/search/detail/DetailView.do?p_mat_type=1a0202e37d52c72d&control_no=9dbce2af8146d848c85d2949c297615a&keyword=인공지능,초록이 없습니다.
심볼릭 인공지능을 위한 R 심볼릭 데이터분석,전성해(Sunghae Jun),한국지능시스템학회,2017,한국지능시스템학회논문지,https://www.riss.kr/search/detail/DetailView.do?p_mat_type=1a0202e37d52c72d&control_no=14cd6e1a3ee39df14884a65323211ff0&keyword=인공지능,"컴퓨터와 인간은 분명 다르지만 기본적으로 데이터를 저장하고 처리하는 개념적 측면에서는 서로 유사한 구조를 갖는다. 하지만 수집된 전체 데이터를 처리하고 분석하는 컴퓨터와는 달리 인간은 요약된 패턴 단위로 데이터를 처리한다. 즉 인간은 전체 데이터를 다루기보다는 요약된 정보를 통해 최적의 의사결정을 한다. 전체 데이터보다 요약된 정보만을 관리하면 시간과 비용 면에서 더 효율적인 시스템을 구축할 수 있다. 특히 빅데이터 환경에서 인공지능의 학습을 위한 대용량 데이터의 처리 및 분석을 위하여 요약된 정보에 기반 한 데이터학습에 대한 필요성이 제기되고 있다. 본 연구에서는 이와 같이 요약된 정보에 기반 한 심볼릭 인공지능 시스템의 효율적인 구축을 위하여 통계학의 심볼릭 데이터분석에 대하여 연구한다. 특히 대표적인 데이터언어인 R에서 제공하는 심볼릭 데이터분석 함수를 이용한 심볼릭 인공지능에 대한 방법을 소개한다. 제안방법의 성능평가를 위하여 객관적인 기계학습 데이터 사례를 이용하였다. Computers and humans are different, but basically they have a similar structure in conceptual aspects of data storing and processing. However, unlike computers that process and analyze the entire data collected, humans process the data in a summarized pattern. In other words, humans make the best decisions through summarized information rather than whole data. By managing only summarized information, you can build a more efficient system in terms of time and cost. In particular, there is a need for learning from data based on summarized information for processing and analyzing large amounts of data for artificial intelligence learning in a big data environment. In this paper, symbolic data analysis of statistics is studied for efficient construction of symbolic artificial intelligence system based on the information summarized in this way. We introduce a method for symbolic artificial intelligence using symbolic data analysis functions provided by R data language. In order to evaluate the performance of proposed method, objective machine learning data were used."
소셜 미디어 상에서의 인공지능 관련 사회적 여론에 대한다 범주 감성 분석,"이상원,최창욱,김동성,여운영,김종우",한국지능정보시스템학회,2018,지능정보연구,https://www.riss.kr/search/detail/DetailView.do?p_mat_type=1a0202e37d52c72d&control_no=51fa16c99f2e25f5b7998d826d417196&keyword=인공지능,"As AI (Artificial Intelligence) technologies have been swiftly evolved, a lot of products and services are under development in various fields for better users’ experience. On this technology advance, negative effects of AI technologies also have been discussed actively while there exists positive expectation on them at the same time. For instance, many social issues such as trolley dilemma and system security issues are being debated, whereas autonomous vehicles based on artificial intelligence have had attention in terms of stability increase. Therefore, it needs to check and analyse major social issues on artificial intelligence for their development and societal acceptance. In this paper, multi-categorical sentiment analysis is conducted over online public opinion on artificial intelligence after identifying the trending topics related to artificial intelligence for two years from January 2016 to December 2017, which include the event, match between Lee Sedol and AlphaGo. Using the largest web portal in South Korea, online news, news headlines and news comments were crawled. Considering the importance of trending topics, online public opinion was analysed into seven multiple sentimental categories comprised of anger, dislike, fear, happiness, neutrality, sadness, and surprise by topics, not only two simple positive or negative sentiment. As a result, it was found that the top sentiment is “happiness” in most events and yet sentiments on each keyword are different. In addition, when the research period was divided into four periods, the first half of 2016, the second half of the year, the first half of 2017, and the second half of the year, it is confirmed that the sentiment of 'anger' decreases as goes by time. Based on the results of this analysis, it is possible to grasp various topics and trends currently discussed on artificial intelligence, and it can be used to prepare countermeasures. We hope that we can improve to measure public opinion more precisely in the future by integrating empathy level of news comments. 인공지능 기술의 비약적인 발전으로 인하여, 사용자의 편의성 증대를 목적으로 다양한 분야에서 관련된 제품과 서비스들의 개발이 이루어지고 있다. 이러한 기술의 발전에는 긍정적인 파급 효과에 대한 기대감이 존재하나, 향후 발생 가능한 부정적인 측면에 대한 논의도 활발히 이루어지고 있다. 예를 들어, 인공지능 기술 기반의 자율주행 자동차의 경우 안정성의 향상이라는 측면에서 많은 관심을 받고 있으나, 트롤리 딜레마, 시스템 보안 문제 등의 사회적 이슈 또한 활발히 논의되고 있다. 이에 따라, 인공지능 관련 기술의 발전과 사회적 수용을위해서는 사회적으로 논의되는 주요 관련 이슈들에 대한 확인과 효과적인 분석이 요구된다.
이를 위해, 본 연구에서는 ‘이세돌 vs 알파고’ 시점인 2016년 3월을 포함하여 2016년 1월부터 2017년 12월까지 2년 동안의 인공지능과 관련된 사회적인 이슈들을 파악하고 온라인상에서 발생되는 사회적 여론에 대하여다 범주 감성을 분석하고자 한다. 이를 위하여 국내 대표적인 포털 사이트에서 인공지능 관련 뉴스의 수와 관련된 뉴스 제목, 뉴스의 댓글을 웹 크롤링(Web Crawling) 하였다. 사회적 여론에 대한 다 범주 감성 분석은 논의되는 이슈들의 중요성을 고려하여 단순 긍정 또는 부정이 아닌, 분노, 혐오, 두려움, 행복, 중립, 슬픔, 놀라움의7가지 다 범주 감성으로 분석하였다.
분석 결과, 대부분의 이벤트 기간에 대하여 1위 감성은 ‘행복’으로 나타났지만 각 키워드에 대하여 나오는 감성이 상이함을 볼 수 있었다. 또한 2016년 상반기, 하반기, 2017년 상반기, 하반기로 나누어 보았을 때 시간이지남에 따라 ‘분노’의 감성이 낮아짐을 확인하였다. 이러한 분석 결과를 바탕으로 인공지능과 관련하여 현재 논의되고 있는 다양한 이슈와 동향 파악이 가능하며, 이에 대한 대응 방안 마련에 활용이 가능할 것이다. 향후 감성 분석기의 성능 향상과 댓글에 대한 공감 및 비공감도의 가중치를 추가하여 분석한다면 사회적 여론을 보다세밀하게 파악 할 수 있을 것이다."
