제목,작성자,출판사,제작년도,journal,link,abstracts
인공지능의 법적정의와 인공지능기술 발달에 따른 국가의 기본권 보호의무,강현구,헌법재판연구원,2021,헌법재판연구,https://www.riss.kr/search/detail/DetailView.do?p_mat_type=1a0202e37d52c72d&control_no=426211cc273ca8416aae8a972f9116fb&keyword=인공지능,"최근 기계학습의 일종인 심층학습에 관한 연구의 발달은 인공지능을 급격하게 발달시켰다. 사람이 만들어낸 기계가 사람의 능력을 넘어선 예는 전부 열거할 수 없을 정도로 많지만, 인공지능은 사람의 본질적이고 가장 중요한 능력인 지능을 가진 실체라는 점에서 다른 기계들과 차이점이 있다. 이러한 차이점은 인공지능에 대한 기대와 함께 우려도 같이 가지고 오는데, 이러한 우려는 인공지능에 관하여 헌법적논의를 할 필요성을 제공한다.
국가의 기본권보호의무의 이행은 일반적으로 다른 기본권 주체의 기본권을 제한하는 결과도 함께 가져오므로, 인공지능에 의해 기본권을 침해당할 우려가 있는 사인을 보호하기 위해 법규범을 제정한다면인공지능을 개발하여 사용하려는 자의 직업의 자유 등을 제한하게 된다. 즉, 기본권 제한을 수반하는 법률에 해당하게 되는 것이다. 기본권 제한을 수반하는 법률은 명확성의 원칙을 충족시켜야 하므로 그 규율대상이 명확하게 규정되어 있을 것이 요구되는데, 인공지능에 관한 법률은 먼저 인공지능의 개념을 명확히 해야 한다. 결국 인공지능에 의해 침해되는 기본권에 대한 국가의 보호의무의 논의는 인공지능의개념이 무엇인가에 대한 논의에서부터 출발하여야 하는 것이다. 인공지능에 대하여 충분히 수긍할 만한개념이 정해지지 않은 상태에서 관련 법률을 제정한다면, 국가의 기본권보호의무를 제대로 이행하지 못하면서 인공지능을 사용하려는 사인의 직업수행의 자유 등을 침해할 우려가 있기 때문에 인공지능의 법적 개념 정립은 헌법적으로 중요한 의미가 있다. 인공지능에 대하여 접근하는 방법은 인간을 중심에 두고 그 능력을 전자적으로 구현하는 것을 중점에 두는 방법, 불확실한 상황 하에서 가장 합리적인 결정을내릴 수 있는 전자적 실체를 만드는 것을 중점에 두는 방법 등이 있을 수 있다. 그러나 현재 인공지능연구의 대부분은 후자를 중심으로 이루어지고 있고, 현재 사용되고 있는 인공지능의 실체가 인간의 지적능력을 그대로 구현한 것으로 보기에는 어렵다는 점에서 인공지능의 개념 정의를 할 때에는 후자에 중점을 두어야 한다. 그렇다면 인공지능의 법적 개념을 「복잡한 환경 아래에서 데이터 분석을 통해서 환경을인식하고, 이러한 데이터로부터 얻어진 정보와 지식에 기반을 둔 탐색으로 주어진 목적 달성에 가장 적합한 행동을 선택하여 실행하는, 인간에 의해 고안된 소프트웨어 또는 하드웨어 시스템」이라고 하는 것이 규율의 대상을 놓치지 않아 기본권보호의무를 충분히 이행하면서도 기본권 제한 규정의 명확성을 추구하는 방법이라고 생각한다. 물론 이러한 정의도 명확하지 않다고 볼 여지도 있으나 인공지능은 계속해서 발전하는 분야이고 그 응용분야도 다양하기 때문에 그 개념을 어느 정도는 개방된 상태로 둘 필요가있다.
인공지능에 대한 사항을 정하는 법률에서 지나치게 규제의 관점에서만 접근한다면, 인공지능의 발전을 가로막을 수 있는데 이것은 인공지능이 창출할 수 있는 경제적 가치 등에 비추어 올바른 현상이 아니다. 인공지능으로 침해 가능한 사인의 기본권을 보호하면서도 인공지능의 발전을 저해시키는 일은 없어야 하는데, 현재로서는 법률에 많은 내용을 담기 보다는 민주적이면서도 전문적인 심의를 할 수 있는 기구를 만들어 각종 처분을 할 수 있도록 하는 것이 바람직한 방향이라고   ..."
지식재산권 보호 정당성 고찰을 통한 인공지능 창작물의 새로운 보호 방안 연구,윤영진,서울대학교 기술과법센터,2020,Law & technology,https://www.riss.kr/search/detail/DetailView.do?p_mat_type=1a0202e37d52c72d&control_no=44caf0d9f0579624c85d2949c297615a&keyword=인공지능,"4차 산업혁명과 관련된 새로운 기술들은 다양한 법적 이슈를 낳으면서 입법자들과 법률가들을 곤란하게 만들고 있다. 특히 인공지능의 출현은 기존 지식재산권 보호 체계에 큰 혼란을 야기하고 있다. 인공지능을 발명자 또는 저자로 인정할 수 있는지 문제에서부터 인공지능이 지식재산권을 침해했을 때 발생하는 책임 소재와 구제 방법 문제까지의 다양한 법적 이슈들은 지금까지 없었던 지식재산권법의 근본적인 영역에 대하여 물음을 던지고 있는 것이다. 이에 본고에서는 인공지능 창작물의 보호 방안에 관한 다양한 선행연구를 분석하였고, 분석 결과 인공지능 창작물의 지식재산권법상 보호 방안에 대하여 뚜렷한 해결책이 없이 다양한 의견이 제시되고 있음을 확인하였다. 뚜렷한 해결책이 제시되지 못한 이유는 현행법의 해석론상 불명확성을 제거하기에 한계가 있기 때문인 것으로 판단 되었다. 이런 불명확성을 해소하기 위해 인공지능 창작물의 지식재산권법상 보호 정당성 문제를 깊이 들여다보았다. 현재 지식재산권 정당화의 이론적 근거로 받아들여지는 인센티브 이론은 인간 발명자 또는 저자를 전제로 하여 발전한 이론으로, 인센티브가 필요 없는 인공지능에게 인센티브 이론을 근거로 한 지식재산권 보호 체계는 적합하지 않다는 결론에 도달하였다. 따라서 인공지능 창작물을 지식재산권법에서 보호하기 위해서는 기존의 정당화 이론에 새로운 변화나 수정이 필요하며, 이런 변화나 수정에는 지식재산권의 보호로부터 파생되는 결과의 공유와 확산을 중시하는 실용주의 이론(Investment Theory)의 시각을 강조하는 것이 타당한 것으로 분석되었다. 선행연구에 대한 분석과 보호 정당화 이론에 대한 고찰을 기초로 지식재산권법상 인공지능 창작물의 보호 프레임워크에 대한 새로운 방향 또는 시각을 검토하였다. 그 결과 인공지능 창작물의 ‘생산’과 ‘이용’ 중에서 실용주의 이론을 기초로 ‘이용’이라는 공익적 측면을 강조해 누구나 인공지능 창작물을 사용할 수 있도록 하되 그 사용에 대한 로열티를 지불하는 약한 보호의 인센티브로 인공지능 관련자들을 유인하여 인공지능 산업의 발전과 혁신을 이룰 수 있는 새로운 보호 프레임워크를 제안한다. 일예로, 인공지능이 인간의 개입이 없이 창작한 결과물은 소유자를 정할 수 없으므로 국유재산으로 처리하되, 로열티 지불시 누구나 사용할 수 있도록 하고, 로열티의 일부를 인공지능 산업 발전에 지원되도록 제도화하는 것을 고려해볼 수 있다. 이와 같은 새로운 보호 프레임워크 설계에는 표준기술의 ‘이용’을 장려하는 표준특허제도가 참고가 될 수 있을 것으로 생각 된다. New technologies related to the Fourth Industrial Revolution are creating various legal issues, putting legislators and lawyers in trouble. In particular, the emergence of artificial intelligence is causing great confusion in the existing intellectual property protection system. From the issue of whether artificial intelligence can be recognized as an inventor or author to the issues of responsibility and remedies arising when artificial intelligence violates intellectual property rights, various legal issues are raising questions about the fundamental areas of the intellectual property law that has never been before. Accordingly, this study analyzed various prior studies on how to protect artificial intelligence creations, and as a result of analysis, it was confirmed that various opinions were presented without a clear solution to the AI creation protection method. It was judged that the reason for the lack of a clear solution was that there was a limit to eliminating ambiguity in the interpretation of the current law. To resolve this uncertainty, I looked into the issue of justification for protection under the Intellectual Property Law of AI creations. The incentive theory, which is currently accepted as the basis for intellectual property justification theory, is a theory developed on the premise of human inventors or authors. It was concluded that an intellectual property protection system based on the incentive theory is not suitable for artificial intelligence that does not require incentives. Therefore, in order to protect AI creations in the Intellectual Property Rights Act, new changes or modifications are needed in the existing justification theory, and it was analyzed that it is reasonable to emphasize the view of Investment Theory that values the sharing and spreading of results derived from the protection of intellectual property rights. Based on the analysis of prior research and the consideration of the protection justification theory, a new direction or perspective on the protection framework of AI creations under the Intellectual Property Rights Act was reviewed. In the aspect of ‘production’ and ‘use’ of AI creations, ‘use’, which is evaluated as representing the public interest, is emphasized by Investment Theory. I propose a new protection framework that will allow anyone to use AI creations but attract AI-associated people with weak protection incentives that pay royalties for their use, thereby achieving the development and innovation of the artificial intelligence industry. As an example, the intellectual property rights of AI created without human intervention cannot be determined by the owner, so it is treated as a national property, but consider making it possible to use it when anyone pays royalties, and institutionalize some of the royalties to be used to support the development of the artificial intelligence industry. It is thought that a standard patent system that encourages the ‘use’ of standard patent technologies could be a reference to this new protection framework design."
인공지능(AI)로봇의 법적 문제에 관한 연구 - EU의 RoboLaw의 입법동향을 중심으로 -,"류지웅(Ryu, Ji-Woong)",한국토지공법학회,2017,土地公法硏究,https://www.riss.kr/search/detail/DetailView.do?p_mat_type=1a0202e37d52c72d&control_no=b944ae6566ae53564884a65323211ff0&keyword=인공지능,"인공지능(AI)의 진화로 미래에는 생산이 폭발적으로 늘어날 것이며 이를 어떻게 분배할 것인지는 중요한 사회적 어젠다(Agenda)이다. 또한 법학에 있어서 인공지능과 관련된 많은 법적 이슈가 대두되고 있다.
과학기술의 발전으로 인공지능(AI)은 윤리적 대상인지, 윤리적 주체의 범위가 인공지능 (AI)에까지 확대될 경우 인공지능 자체에 대한 책임 문제와 인공지능을 이용하는 사람에게 그 책임을 다툴 것인지에 대한 법적 접근이 필요하다. 인공지능을 소유 및 이용하는 자의 자발적 행위가 인간뿐만 아니라 세계에 영향을 미칠 때 이에 대한 법적 조치는 향후 중요한 논의의 대상이기 때문이다. 또한 현재의 기술단계에서 인공지능(AI)과 인간의 유사성 특히 인공지능의 알고리즘과 인간의 뇌과학과 관련된 논의 등은 우리에게 시사하는 바가 크다.
본 논문에서는 우선 인공지능(AI)과 인식론의 문제 및 뇌과학과 관련된 인공지능의 알고리즘 분석과 인간의 뇌분석과의 관련 문제 등에 대한 논의를 살펴 본 후 인공지능(AI) 와 인간과의 관계설정을 검토한다.
다음으로 인공지능(AI)이 탑제된 로봇의 법률행위에 대한 평가에 대하여 이를 행위자의 관점에서 볼 것인지 도구로 볼 것인지에 대한 책임문제에 대한 검토를 한다. 구체적으로 우리 일상생활 깊숙이 들어온 인공지능(AI)의 영역 자율주행자동차, 저작권, IoT 등 4차산 업혁명과 관련된 시대적 변화에 따라 이에 대한 법정책적 과제에 대하여 검토한다.
인공지능의 발전이 인류에게 위협이 되지 않는 동시에 인류가 다양한 지식서비스의 혜택을 누리기 위해서는 그 개발과 적용에 있어서 윤리적 기준이 매우 중요하다. 위에서 본바와 같이 주요 국가에서 인공지능 윤리헌장을 제정하였고 우리나라의 경우에도 2007년 로봇윤리헌장을 제정하여 인간과 로봇이 상호간에 생명의 존엄성을 존중하고, 정해진 권리, 정보윤리 및 공학윤리 등의 공동원칙을 보호하고 지켜야 함을 천명하고 있다. 그러나 이러한 논의는 단순히 헌장으로 끝낼 것이 아니라 인공지능의 윤리적 판단 기준에 대한 연구는 과학자, 윤리학자, 심리학자, 법조인, 의사, 종교학자, 교육자 등 관련분야의 의견을 모두 반영해야 할 것이다. 우리나라에서도 인공지능을 적용한 로봇이 사회규범에 미치는 영향과 적절한 규제와 정책을 전담하는 부처를 선택한다면 어떤 부처가 적당할지 아니면 전문가로 구성된 독립적 로봇위원회가 적당할지에 대해 본격적 논의가 필요한 시점임을 밝히고, 끝으로 현재까지 가장 적극적으로 인공지능(AI)와 관련하여 각 국의 기본적인 논의와 함께 구체적으로 인공지능(AI) 로봇과 관련된 법률제정이 이루어지고 있는 EU의 관련 규정과 내용 등에 대한 검토를 통해 우리나라가 향후 인공지능(AI)과 관련 법정책의 방향을 제시한다. With the evolution of artificial intelligence (AI), production will explode in the future, and how to distribute it is an important social agenda. There are also many legal issues related to artificial intelligence in law.
As a result of the development of science and technology, artificial intelligence (AI)
is an ethical object, and if the scope of ethical subject extends to artificial intelligence
(AI), legal responsibility for artificial intelligence itself Access is required. It is because the voluntary actions of those who own and use artificial intelligence affect not only
human beings but also the world, legal action against them is the subject of important
discussion in the future. At the present stage of the technology, the similarity of artificial intelligence (AI) with human intelligence algorithms and discussions related to human brain science are very important to us.
In this paper, we first examine the issues of AI and epistemology, and the related artificial intelligence algorithms related to brain science and related issues of human brain analysis, and then compare the relationship between artificial intelligence (AI) Review.
Next, the evaluation of the legal act of the robot with AI is reviewed about the responsibility of whether to view it from the actor  s point of view or the tool.
Specifically, we will examine the legal policy issues in relation to the changes in the artificial intelligence (AI) area that has come into our everyday life, such as autonomous vehicles, copyright, IoT, and other changes related to the fourth industrial revolution.
Ethical standards are crucial in the development and application of artificial intelligence so that the development of artificial intelligence does not pose a threat to mankind and humans enjoy the benefits of various knowledge services. As mentioned
above, in the major countries, an ethics charter has been enacted. In the case of Korea, the robot ethics charter was enacted in 2007 to respect human dignity of human beings and robots. And to protect and preserve the principle. However, rather than simply ending the discussion, the study of the ethical standards of artificial
intelligence should reflect all the opinions of scientists, ethics scholars, psychologists, lawyers, doctors, religious scholars, and educators. In this paper, we propose a robotic robot that can be used as a robot in the field of robotics. In this paper, Finally, to the present, the most active discussions on AI related to each country and the relevant regulations and contents of the EU, which are specifically enacted in relation to AI robots, (AI) and related legal policies in the future."
인공지능에 대한 전자인 제도 도입의 필요성과 실현방안에 관한 고찰,김진우(Chin-Woo Kim),한국법학원,2019,저스티스,https://www.riss.kr/search/detail/DetailView.do?p_mat_type=1a0202e37d52c72d&control_no=47d2c088159fe6dbd18150b21a227875&keyword=인공지능,"프로그램 개발자조차 반응을 더 이상 예측할 수 없고 학습능력에 의하여 진화하는 지능형 로봇과 인공지능의 자율성이 증가함에 따라 전자인 제도 및 이를 위한 책임기금의 도입을 생각해 보아야 하는 상황이 도래하였다. 즉, 자연인과 법인 외에 또 다른 권리주체로서의 “전자인”을 인정할 것인지가 문제된다. 인공지능이 계약당사자가 될 수 있는지, 책임의 주체가 될 수 있는지, 기본권의 향유자가 될 수 있는지는 모두 법인격의 유무와 관련되어 있다. 이미 선진국에서는 이 문제에 관하여 활발히 논의되어 왔다. 이 과정에서 법인격에 관한 매우 상이한 형성 가능성과 정당화 가능성이 제시되었다. 이에 본 연구는 우리 법과 사회적 현실을 고려하여 인공지능에 대한 법인격 부여 내지 전자인 제도의 도입 여부를 시론(試論)적으로 검토하였다. 논의의 주요 결과는 다음과 같다.
  현행 민법의 법리로는 디지털 혁명에 적절히 대응할 수 없어 새로운 규칙 및 인공지능의 법인격의 도입이라고 하는 돌파구가 모색되어야 한다. 표의자 또는 의사표시의 귀속자를 자연인으로 국한하는 전통적 법률행위론은 4차산업혁명 및 인공지능과 같은 오늘날의 기술의 현실과 더 이상 조화를 이루지 못한다.
  인공지능을 새로운 권리주체로 인정하는 것은 매우 근본적인 결단을 의미하지만, 전자인의 도입 내지 인공지능에 대한 법인격의 부여는 인공지능의 사용 시에 계약책임은 물론 불법행위책임에서도 법적 안정성을 제고하는 데이바지 할 것이다. 근대법이 법인제도를 창설할 때에도 초기에는 비판이 적지 않았지만 결국 관철되었다. 오늘날 법인제도의 창설은 근대법의 위대한 문화적 기여로 평가된다. 법인제도에 의하여 자연인의 행동반경이 크게 확장되었기 때문이다. 인공지능에 대한 법인격 부여도 이러한 기회를 제공할 수 있다.
  먼저 법리적으로 보면 인공지능에 대한 법인격을 부여를 반대할 수 있는 논거가 마땅치 않다. 법인의 예에서 볼 수 있듯 법질서는 이미 인위적 존재에 대하여 법인격을 인정하고 있기 때문이다. 현행법상 인공지능의 행위를 누구에게 귀속시킬 것인지와 관련하여 법적 불안정성이 존재한다는 점은 인공지능에 대한 법인격 인정을 위한 중요한 논거이다. 그럼에도 인공지능에 대한 포괄적인 법인격 부여는 요청되지 않는다.
  법윤리적 관점에서 우선 인간의 법적 지위나 우열관계를 훼손할 수 있다는 점과 함께 기계의 인간화에 대한 우려가 표명되고 있다. 그러나 인공지능에 대한 법인격 부여에 의하여 인간의 지위가 열악해지는 사태는 발생하지 않을 것이다. 인공지능의 법적 지위를 규정한 법질서는 궁극적으로 인간이 만들기 때문이다. 그리고 존재론적 의미에서의 권리주체와 법적 의미에서의 권리주체는 구별을 요한다. 그에 따라 인간과 인공지능의 우열관계는 법적으로도 규정될 수 있다. 인공지능은 법적 의미에서의 권리주체에 불과하여 존재론적 의미에서의 권리주체에 항상 귀속되어야 하기 때문이다. 인공지능은 특히 사회적 지능이 결여되어 있는 점에서 인간과 구별된다. 그리고 본질, 구성, 재생산 및 생명의 청사진과 관련하여서도 중대한 차이가 존재한다. 따라서 법윤리적·법철학적 관점에서 인공지능에 대한 법인격 부여를 반대할 이유가 없다.
  인공지능의 취급과 관련하여 법적 안정성의 보장에 관한 사회적 요청은 법인격 부여를 위한 도덕적 자격 및 사회적 역량의 결여를 상쇄할 수 있다. 인공지능의 권리능력은 계약체결에 관한 능력으로 제한하고, 운용자인 자연인 또는 법인을 등록부에 명시하며, 전자서명에 의하여 인공지능의 행위가 운용자에게 귀속됨을 분명히 하고, 인공지능의 책임재산액을 정하며, 운용자에 대한 민사법적·형사법적 행위기준을 설정해야 할 것이다. 결론적으로 법질서는 인공지능에 대하여 법적 의미에서의 법인격을 부여할 수 있다.
  대리(민법 제114조 이하), 이행보조자에 대한 책임(민법 제391조), 사용자책임(민법 제756조)은 대리인, 이행보조자 및 피용자로서의 인공지능에 대하여 법인격이 전제되는 경우에 한하여 유추 적용될 수 있다. 또한 인공지능의 기본권향유능력을 인정할 때에만 인공지능은 책임재산에 대하여 소유권을 갖게 될 수 있다. 인공지능에 대한 법인격의 부여는 사회와 잠재적 피해자는 물론 시스템운용자 모두에 대하여 “윈윈(win-win) 상황”을 가져올 것이다. The question of the legal implications of increasing autonomy of intelligent agents was discussed for the first time in the context of contract conclusions on the Internet. The general question was whether such systems should have legal personality and thus legal personhood, as well as the concrete classification of the activities of the systems in a contractual context. Due to the autonomy and intelligence of an autonomous system, the question arises as to whether this makes its own declaration of intent. According to the concrete definition of legal personhood, this means the ability to be the bearer of rights and obligations. This question is closely linked to the examination of the existence of legal personhood. However, the Korean Civil Code recognizes these by nature only with natural persons and, in addition, attributes them to legal persons through recognition by the legal system. However, such recognition has not (yet) been made with respect to autonomous systems, and it is questionable whether this will ever succeed. This discussion is now revived, albeit under the auspices of even more autonomous, even more intelligent, more self-learning machines. It was regularly determined from the point of view of the declaration of intent, that it always presupposes a human act and then discusses the own “legal personality” or “legal personhood” of intelligent agents. Here, too, the “attribution paradigm”, as it plays a special role in today""s discussion, was at the center of the discussion.
  The technology has meanwhile developed enormously. Nowadays, the question is increasingly raised as to whether it makes sense to attribute legal personhood to autonomous systems or at least to what extent the attribution rules change and shift due to the autonomy of the systems. The key question of all liability problems arising in the context of digitization is therefore seen in terms of whom a possible misbehavior of autonomous systems can be attributed and how risks associated with the production and use of autonomous systems can be distributed in an appropriate manner. This applies both in the area of legal attribution as well as in the area of liability.
  It should, however, be essential to take sufficient account of the current technical development. Only by examining the concrete technical functionality of the systems can it be deduced how far they control their actions and “decisions” and how the conclusions can be drawn for their classification as attributable activities. Otherwise, attempts by critics of a future lack of imputation could not be explained."
